{
  "$schema": "https://json-schema.org/draft/2020-12/schema",
  "$id": "https://stagebench.local/schemas/evaluation.schema.json",
  "title": "Stagebench scored phase evaluation",
  "description": "runs/<id>/evaluations/stage<N>.json — the output of pnpm bench score.",
  "type": "object",
  "required": ["rubricVersion", "runId", "stage", "status", "score", "categories", "technicalGate"],
  "properties": {
    "rubricVersion": { "type": "string" },
    "runId": { "type": "string" },
    "stage": { "type": "integer", "minimum": 1, "maximum": 4 },
    "stageName": { "type": "string" },
    "status": { "const": "complete" },
    "evaluator": { "type": "string" },
    "evaluatedAt": { "type": "string" },
    "summary": { "type": "string" },
    "score": { "type": "number", "minimum": 0, "maximum": 100 },
    "rawScore": { "type": "number", "minimum": 0, "maximum": 100 },
    "categories": {
      "type": "array",
      "minItems": 1,
      "items": {
        "type": "object",
        "required": ["id", "weight", "score", "criteria"],
        "additionalProperties": true
      }
    },
    "technicalGate": {
      "type": "object",
      "required": ["passed", "checks"],
      "additionalProperties": true
    },
    "issues": { "type": "array" }
  },
  "additionalProperties": true
}
