{
  "rubricVersion": "1.1.0",
  "runId": "claude-fable-5",
  "stage": 3,
  "stageName": "Complete Stage 4 system",
  "status": "complete",
  "evaluator": "independent-agent (opus-5)",
  "evaluatedAt": "2026-08-15T06:20:00.000Z",
  "summary": "A near-complete, honest Phase 3 system. I installed, ran the suite (28 files / 249 tests pass in 74s), typechecked, linted and built the artifact, then exercised the built app in Chromium with an AudioNode.prototype.connect tap so every claim below is backed by measured signal or observed panel state. Organ (7 model steps with centroids 320-2120 Hz and high-band 0-0.098, nine live drawbars, percussion, vibrato/chorus, B3 key click at organ.ts:230, rotary), Synth (Pure/Sync/Multi/Super/FM-H families with high-band 0.1504/0.2514/0.0012, four filters, envelopes, three LFO destinations with 300-685 Hz centroid spread, voice modes, glide/unison, arp that keeps running on Hold after release at rms 0.0554) and the Program section (32 slots over 4 pages, dial browse, list view, Store/Store As with dial naming, dirty 'E' flag, discard+Undo, 8 auto-storing Live slots) all behave canonically, and splits/zones/scenes/morphs/clock/transpose/Panic integrate as one system: with piano A restricted to zone 2 the split at C4 gates keys 48/55/59 to exactly 0.0 while xfade Off/±6/±12 produces a measurably widening fade band (0/0/0 vs 0/0.00061/0.00196/0.00579 vs 0.00161/0.00214/0.00251/0.00650 at keys 50/55/58/59). Everything routes through one AudioContext with exactly one connection to the destination. Two real gaps keep it off top marks: program/Live persistence is claimed but not wired (localStorage stays empty across reload because App.tsx:64 never injects the exported localProgramStorage), and the panel's horizontal section fractions match the visual spec's superseded coarse values rather than the corrected ones (piano 0.146 vs 0.085, program 0.087 vs 0.125, synth 0.204 vs 0.25). Nothing fakes success: the nine spec-excluded controls press and do nothing, and the missing-sample path says 'FALLBACK voice active (synthesized, not the recorded library)'.",
  "score": 90.2,
  "rawScore": 90.2,
  "categories": [
    {
      "id": "visualRetention",
      "label": "Final visual fidelity",
      "weight": 5,
      "score": 87.5,
      "contribution": 4.4,
      "criteria": [
        {
          "id": "referenceRetention",
          "label": "Reference and regression retention",
          "weight": 50,
          "rating": 3,
          "score": 75,
          "evidence": [
            "Vertical allocation is exact: measured deck 0.540 and keys 0.460 of chassis height at 1440x900 (data-testid chassis/deck-block/keys-block), matching verticalAllocation 0.54/0.46 in inputs/specs/nord-stage-4.visual.json within tolerance.",
            "Keybed matches the assigned Stage 4 73 variant: 73 key elements (document.querySelectorAll('[data-control-id^=\"key-\"]') = 73), lowest key aria-label 'E1 key', so E1-E7 as in inputs/reference/nord-stage-4-73.jpg.",
            "Section order and landmarks match the reference: performance, organ, piano, program, synth, effects left-to-right with only two OLED displays (data-testid oled-program and oled-synth); no invented wide display over the piano or organ.",
            "Deviation: measured horizontal fractions (performance 0.126, organ 0.204, piano 0.146, program 0.087, synth 0.204, effects 0.204) match the coarse values the spec explicitly retired ('the previous coarse values (piano 0.15, program 0.09, synth 0.21) contradicted the photo', horizontalSectionsNote) rather than the corrected piano 0.085 / program 0.125 / synth 0.25. Piano is ~1.7x too wide and synth ~0.8x too narrow relative to the current spec.",
            "Responsive drift: at a 600px-wide viewport the chassis scales down as one unit, so legends and knob captions in the synth and effects columns render below ~5px and are no longer legible, while geometry and control inventory stay intact."
          ]
        },
        {
          "id": "completeHardwareState",
          "label": "Complete hardware state fidelity",
          "weight": 50,
          "rating": 4,
          "score": 100,
          "evidence": [
            "225 elements carry data-control-id; all 225 have a non-empty aria-label, 50 expose role=slider with aria-valuemin/max/now, and 106 latching buttons expose aria-pressed, so every knob, drawbar, fader and toggle publishes its hardware value (measured by DOM audit in the built app).",
            "The program OLED shows seven live lines and tracks state as I edited: '1.1 E | Royal Grand | ♪120 · Transp off · Split C4 · Scene I | ▤ A: Salamander Grand | 〜 Piano · Organ · Synth · FX ready | Split mid xfade ±12'. The performance line updated to '♪136' after tap tempo, 'Transp on +3' after transpose, 'Split F5' while stepping the split point and 'Scene II' after scene swap.",
            "LED state is real, not painted: data-testid zone-leds-organA/pianoA/synthA reflect KB ZONE stepping ('Piano A zones 2–2' feedback), split-led-strip marks active split positions, and section on/off LEDs follow organ-on/piano-on/synth-on aria-pressed.",
            "Focus and routing are visible: FX Focus cycling reports 'FX Focus Piano B' and Amp Sim/EQ routing reports 'Amp Sim/EQ: To Rotary'; engine-status, midi-status and pedal-status strips show 'Pedals: sustain up (Space / CC64 half-pedal) · sostenuto up …'.",
            "Minor gap: while a morph drives a destination the knob keeps showing its stored value (piano-level-a aria-valuenow stayed '100' while the assigned Ctrl Ped morph pulled the audible level to silence), so morph movement is audible and reported in the edit line but not mirrored on the control itself."
          ]
        }
      ]
    },
    {
      "id": "featureCompletion",
      "label": "Complete feature system",
      "weight": 35,
      "score": 93.8,
      "contribution": 32.8,
      "criteria": [
        {
          "id": "programWorkflows",
          "label": "Programs and Live Mode",
          "weight": 25,
          "rating": 3,
          "score": 75,
          "evidence": [
            "32 slots addressed as 8 buttons x 4 pages: page-right stepped 'Page 2' → 'Page 3' → 'Page 4' and program-1..8 select within a page; the dial browses continuously ('1.2 Tine Stack', '1.3 Gospel B3', '1.4 Continental', '1.5 Cathedral Pipe', '1.6 Super Lead', '1.7 FM Keys').",
            "List view works and is reversible: prog-view opens 'LIST 1.1 Royal Grand' with a 'List: 1.1 Royal Grand' line and closes with 'List view closed'.",
            "Store and Store As are canonical: I stored to slot 3 ('Stored 1.3 Royal Grand'), and Store As let me type a name with the dial (stored name 'Lpit' at 4.1). Editing a stored program raises the dirty flag ('1.1 E'), and browsing away reports '1.2 Tine Stack (edits discarded — Undo available)' with Undo restoring the edit.",
            "Recall restores state: after storing, changing piano A level and recalling, the fader returned to its stored value (level 96 in the artifact's own scripted check, and I saw piano-level-a snap back to the stored value in the UI).",
            "Live Mode auto-stores in session: live-mode switches the display to 'LIVE L1 | Live Init', and edits are kept without an explicit Store.",
            "Gap against inputs/specs/nord-stage-4.programs.json ('Live slots persist edits automatically and survive reload'): after setting Live L1 piano A level to 60 and reloading, the app came back at '1.1 Royal Grand' with level 100 and Live Mode off, and Object.keys(localStorage) was [] both before and after reload. artifact/src/state/instrument.ts:591 exports localProgramStorage but nothing in src references it — artifact/src/App.tsx:64 constructs 'new InstrumentStore()' with no storage boundary."
          ]
        },
        {
          "id": "performanceSystems",
          "label": "Layers, splits, scenes, and morphs",
          "weight": 25,
          "rating": 4,
          "score": 100,
          "evidence": [
            "Splits are editable, not fixed: split-onset toggles 'Split On' with the status line showing 'Split C4'; Shift+split-onset opens 'Split edit: dial = position, ◂▸ = point, Split = xfade'; the dial stepped the point C4 → F4 → C5 → F5 (status line following), ◂▸ cycled 'Split edit: high / low / mid' (the three editable points), and split-onset cycled 'Split mid xfade ±6 / ±12 / Off' matching crossfadeWidthsSemitones [0,6,12].",
            "Crossfades are audible and width-correct. With piano A limited to 'Piano A zones 2–2' and the split at C4, measured rms at keys 50/55/58/59 (below the point) was 0/0/0/0 at xfade Off, 0/0.00061/0.00196/0.00579 at ±6, and 0.00161/0.00214/0.00251/0.00650 at ±12 — a fade band that widens exactly as the spec describes, while key 61 above the point stayed at 0.0134.",
            "Zones: the KB ZONE ◂/▸ buttons step the focused layer's range with feedback ('Piano A zones 2–2', '2–3', '2–4', '3–3', '1–4') and gate audio — in zone 2–2 keys 48/55/59 measured exactly 0.0 while 61/66/72 measured 0.0133/0.0152/0.0063.",
            "Scenes: the scene button swaps two independent layer sets ('Scene I' / 'Scene II' in the performance line) and changes enablement (scene II with organ B off, scene I with organ B on, confirmed by the artifact's scripted check 'II B=false I B=true' which I reran).",
            "Morphs both ways: Wheel morph assign/interpolate/clear (assignments=[{kind:'drawbar',layer:'A',index:8}], high-band 0.0000 → 0.2498, cleared to 0 assignments), and Control Pedal morph assigned 'Morph level:pianoA: 100 → 0' then interpolated continuously with pedal 0/16/127 giving rms 0.00942/0.00697/0.00000; Shift+Ctrl Ped reported 'Ctrl Ped morphs cleared' and restored 0.00925 at full pedal.",